{
  "Members": [
    {
      "MemberId": 34,
      "MemberFirstName": "Markus",
      "MemberLastName": "Atzm\u00FCller",
      "MemberBirthdate": "17-09-1982",
      "YouthStatus": 1,
      "FullName": "Atzm\u00FCller Markus",
      "BirthDate": "1982-09-17T00:00:00",
      "AgeCategory": "U20\u002B",
      "Age": 43,
      "CategoryColor": "bg-secondary text-white"
    },
    {
      "MemberId": 6,
      "MemberFirstName": "Benjamin",
      "MemberLastName": "Burgert-Vogl",
      "MemberBirthdate": "10-10-2017",
      "YouthStatus": 1,
      "FullName": "Burgert-Vogl Benjamin",
      "BirthDate": "2017-10-10T00:00:00",
      "AgeCategory": "U8",
      "Age": 8,
      "CategoryColor": "bg-success text-white"
    },
    {
      "MemberId": 16,
      "MemberFirstName": "Valentin",
      "MemberLastName": "Dietrich-Malzer",
      "MemberBirthdate": "04-11-2014",
      "YouthStatus": 1,
      "FullName": "Dietrich-Malzer Valentin",
      "BirthDate": "2014-11-04T00:00:00",
      "AgeCategory": "U12",
      "Age": 11,
      "CategoryColor": "bg-primary text-white"
    },
    {
      "MemberId": 11,
      "MemberFirstName": "Jakob",
      "MemberLastName": "Distlbacher",
      "MemberBirthdate": "01-12-2015",
      "YouthStatus": 1,
      "FullName": "Distlbacher Jakob",
      "BirthDate": "2015-12-01T00:00:00",
      "AgeCategory": "U10",
      "Age": 10,
      "CategoryColor": "bg-info text-dark"
    },
    {
      "MemberId": 29,
      "MemberFirstName": "Tobias",
      "MemberLastName": "Dolzer",
      "MemberBirthdate": "17-04-2010",
      "YouthStatus": 1,
      "FullName": "Dolzer Tobias",
      "BirthDate": "2010-04-17T00:00:00",
      "AgeCategory": "U16",
      "Age": 15,
      "CategoryColor": "bg-danger text-white"
    },
    {
      "MemberId": 28,
      "MemberFirstName": "Jasmin",
      "MemberLastName": "Edlbauer",
      "MemberBirthdate": "15-08-2011",
      "YouthStatus": 1,
      "FullName": "Edlbauer Jasmin",
      "BirthDate": "2011-08-15T00:00:00",
      "AgeCategory": "U14",
      "Age": 14,
      "CategoryColor": "bg-warning text-dark"
    },
    {
      "MemberId": 32,
      "MemberFirstName": "Mario",
      "MemberLastName": "Edlbauer",
      "MemberBirthdate": "20-05-2008",
      "YouthStatus": 1,
      "FullName": "Edlbauer Mario",
      "BirthDate": "2008-05-20T00:00:00",
      "AgeCategory": "U18",
      "Age": 17,
      "CategoryColor": "bg-dark text-white"
    },
    {
      "MemberId": 3,
      "MemberFirstName": "Paul",
      "MemberLastName": "Frank-Pr\u00E4hofer",
      "MemberBirthdate": "01-07-2017",
      "YouthStatus": 1,
      "FullName": "Frank-Pr\u00E4hofer Paul",
      "BirthDate": "2017-07-01T00:00:00",
      "AgeCategory": "U8",
      "Age": 8,
      "CategoryColor": "bg-success text-white"
    },
    {
      "MemberId": 22,
      "MemberFirstName": "Luisa",
      "MemberLastName": "Frank-Pr\u00E4hofer",
      "MemberBirthdate": "14-10-2012",
      "YouthStatus": 1,
      "FullName": "Frank-Pr\u00E4hofer Luisa",
      "BirthDate": "2012-10-14T00:00:00",
      "AgeCategory": "U14",
      "Age": 13,
      "CategoryColor": "bg-warning text-dark"
    },
    {
      "MemberId": 8,
      "MemberFirstName": "Miriam",
      "MemberLastName": "Gadermeier",
      "MemberBirthdate": "27-09-2017",
      "YouthStatus": 1,
      "FullName": "Gadermeier Miriam",
      "BirthDate": "2017-09-27T00:00:00",
      "AgeCategory": "U8",
      "Age": 8,
      "CategoryColor": "bg-success text-white"
    },
    {
      "MemberId": 17,
      "MemberFirstName": "Lukas",
      "MemberLastName": "Gadermeier",
      "MemberBirthdate": "16-04-2013",
      "YouthStatus": 1,
      "FullName": "Gadermeier Lukas",
      "BirthDate": "2013-04-16T00:00:00",
      "AgeCategory": "U12",
      "Age": 12,
      "CategoryColor": "bg-primary text-white"
    },
    {
      "MemberId": 31,
      "MemberFirstName": "Anja",
      "MemberLastName": "Hofstadt",
      "MemberBirthdate": "10-11-2009",
      "YouthStatus": 1,
      "FullName": "Hofstadt Anja",
      "BirthDate": "2009-11-10T00:00:00",
      "AgeCategory": "U16",
      "Age": 16,
      "CategoryColor": "bg-danger text-white"
    },
    {
      "MemberId": 20,
      "MemberFirstName": "Madleen",
      "MemberLastName": "Holzmann-Obermayr",
      "MemberBirthdate": "25-02-2013",
      "YouthStatus": 1,
      "FullName": "Holzmann-Obermayr Madleen",
      "BirthDate": "2013-02-25T00:00:00",
      "AgeCategory": "U12",
      "Age": 12,
      "CategoryColor": "bg-primary text-white"
    },
    {
      "MemberId": 4,
      "MemberFirstName": "Alexander",
      "MemberLastName": "Muckenhuber",
      "MemberBirthdate": "07-03-2018",
      "YouthStatus": 1,
      "FullName": "Muckenhuber Alexander",
      "BirthDate": "2018-03-07T00:00:00",
      "AgeCategory": "U8",
      "Age": 7,
      "CategoryColor": "bg-success text-white"
    },
    {
      "MemberId": 55,
      "MemberFirstName": "Maximilian",
      "MemberLastName": "Obermayr",
      "MemberBirthdate": "23-02-2017",
      "YouthStatus": 1,
      "FullName": "Obermayr Maximilian",
      "BirthDate": "2017-02-23T00:00:00",
      "AgeCategory": "U8",
      "Age": 8,
      "CategoryColor": "bg-success text-white"
    },
    {
      "MemberId": 12,
      "MemberFirstName": "Clara",
      "MemberLastName": "Panjan",
      "MemberBirthdate": "23-12-2015",
      "YouthStatus": 1,
      "FullName": "Panjan Clara",
      "BirthDate": "2015-12-23T00:00:00",
      "AgeCategory": "U10",
      "Age": 10,
      "CategoryColor": "bg-info text-dark"
    },
    {
      "MemberId": 21,
      "MemberFirstName": "Isabel",
      "MemberLastName": "Panjan",
      "MemberBirthdate": "01-11-2012",
      "YouthStatus": 1,
      "FullName": "Panjan Isabel",
      "BirthDate": "2012-11-01T00:00:00",
      "AgeCategory": "U14",
      "Age": 13,
      "CategoryColor": "bg-warning text-dark"
    },
    {
      "MemberId": 43,
      "MemberFirstName": "G\u00FCnther",
      "MemberLastName": "Punz",
      "MemberBirthdate": "01-07-1958",
      "YouthStatus": 1,
      "FullName": "Punz G\u00FCnther",
      "BirthDate": "1958-07-01T00:00:00",
      "AgeCategory": "U20\u002B",
      "Age": 67,
      "CategoryColor": "bg-secondary text-white"
    },
    {
      "MemberId": 19,
      "MemberFirstName": "Sophia",
      "MemberLastName": "Schr\u00F6dl",
      "MemberBirthdate": "23-08-2013",
      "YouthStatus": 1,
      "FullName": "Schr\u00F6dl Sophia",
      "BirthDate": "2013-08-23T00:00:00",
      "AgeCategory": "U12",
      "Age": 12,
      "CategoryColor": "bg-primary text-white"
    },
    {
      "MemberId": 56,
      "MemberFirstName": "Jakob",
      "MemberLastName": "Schuster",
      "MemberBirthdate": "16-10-2012",
      "YouthStatus": 1,
      "FullName": "Schuster Jakob",
      "BirthDate": "2012-10-16T00:00:00",
      "AgeCategory": "U14",
      "Age": 13,
      "CategoryColor": "bg-warning text-dark"
    },
    {
      "MemberId": 51,
      "MemberFirstName": "Jessica",
      "MemberLastName": "Seifried",
      "MemberBirthdate": "24-12-2012",
      "YouthStatus": 1,
      "FullName": "Seifried Jessica",
      "BirthDate": "2012-12-24T00:00:00",
      "AgeCategory": "U14",
      "Age": 13,
      "CategoryColor": "bg-warning text-dark"
    },
    {
      "MemberId": 54,
      "MemberFirstName": "David",
      "MemberLastName": "Skralovnik",
      "MemberBirthdate": "22-02-2019",
      "YouthStatus": 1,
      "FullName": "Skralovnik David",
      "BirthDate": "2019-02-22T00:00:00",
      "AgeCategory": "U8",
      "Age": 6,
      "CategoryColor": "bg-success text-white"
    },
    {
      "MemberId": 48,
      "MemberFirstName": "Eva",
      "MemberLastName": "Stegner",
      "MemberBirthdate": "07-12-1997",
      "YouthStatus": 1,
      "FullName": "Stegner Eva",
      "BirthDate": "1997-12-07T00:00:00",
      "AgeCategory": "U20\u002B",
      "Age": 28,
      "CategoryColor": "bg-secondary text-white"
    },
    {
      "MemberId": 52,
      "MemberFirstName": "Felix",
      "MemberLastName": "Steinbruckner",
      "MemberBirthdate": "28-03-2012",
      "YouthStatus": 1,
      "FullName": "Steinbruckner Felix",
      "BirthDate": "2012-03-28T00:00:00",
      "AgeCategory": "U14",
      "Age": 13,
      "CategoryColor": "bg-warning text-dark"
    },
    {
      "MemberId": 5,
      "MemberFirstName": "Charlotte",
      "MemberLastName": "Stoiber-Aigner",
      "MemberBirthdate": "15-12-2016",
      "YouthStatus": 1,
      "FullName": "Stoiber-Aigner Charlotte",
      "BirthDate": "2016-12-15T00:00:00",
      "AgeCategory": "U10",
      "Age": 9,
      "CategoryColor": "bg-info text-dark"
    },
    {
      "MemberId": 23,
      "MemberFirstName": "Franziska",
      "MemberLastName": "Stoiber-Aigner",
      "MemberBirthdate": "28-02-2012",
      "YouthStatus": 1,
      "FullName": "Stoiber-Aigner Franziska",
      "BirthDate": "2012-02-28T00:00:00",
      "AgeCategory": "U14",
      "Age": 13,
      "CategoryColor": "bg-warning text-dark"
    },
    {
      "MemberId": 9,
      "MemberFirstName": "Ines",
      "MemberLastName": "Stumpfl",
      "MemberBirthdate": "20-04-2015",
      "YouthStatus": 1,
      "FullName": "Stumpfl Ines",
      "BirthDate": "2015-04-20T00:00:00",
      "AgeCategory": "U10",
      "Age": 10,
      "CategoryColor": "bg-info text-dark"
    },
    {
      "MemberId": 24,
      "MemberFirstName": "Timo",
      "MemberLastName": "Stumpfl",
      "MemberBirthdate": "05-10-2012",
      "YouthStatus": 1,
      "FullName": "Stumpfl Timo",
      "BirthDate": "2012-10-05T00:00:00",
      "AgeCategory": "U14",
      "Age": 13,
      "CategoryColor": "bg-warning text-dark"
    },
    {
      "MemberId": 26,
      "MemberFirstName": "Alexander",
      "MemberLastName": "Thalhammer",
      "MemberBirthdate": "29-09-2012",
      "YouthStatus": 1,
      "FullName": "Thalhammer Alexander",
      "BirthDate": "2012-09-29T00:00:00",
      "AgeCategory": "U14",
      "Age": 13,
      "CategoryColor": "bg-warning text-dark"
    },
    {
      "MemberId": 27,
      "MemberFirstName": "Moritz",
      "MemberLastName": "Vorhauer",
      "MemberBirthdate": "21-10-2011",
      "YouthStatus": 1,
      "FullName": "Vorhauer Moritz",
      "BirthDate": "2011-10-21T00:00:00",
      "AgeCategory": "U14",
      "Age": 14,
      "CategoryColor": "bg-warning text-dark"
    },
    {
      "MemberId": 1,
      "MemberFirstName": "Matthias",
      "MemberLastName": "Watzinger",
      "MemberBirthdate": "20-04-2007",
      "YouthStatus": 1,
      "FullName": "Watzinger Matthias",
      "BirthDate": "2007-04-20T00:00:00",
      "AgeCategory": "U18",
      "Age": 18,
      "CategoryColor": "bg-dark text-white"
    },
    {
      "MemberId": 25,
      "MemberFirstName": "Alexander",
      "MemberLastName": "Watzinger",
      "MemberBirthdate": "13-05-2012",
      "YouthStatus": 1,
      "FullName": "Watzinger Alexander",
      "BirthDate": "2012-05-13T00:00:00",
      "AgeCategory": "U14",
      "Age": 13,
      "CategoryColor": "bg-warning text-dark"
    }
  ],
  "Presences": [
    {
      "PresenceId": 16,
      "MemberId": 26,
      "PresenceDate": "12.09.2025"
    },
    {
      "PresenceId": 17,
      "MemberId": 25,
      "PresenceDate": "12.09.2025"
    },
    {
      "PresenceId": 18,
      "MemberId": 31,
      "PresenceDate": "12.09.2025"
    },
    {
      "PresenceId": 19,
      "MemberId": 5,
      "PresenceDate": "12.09.2025"
    },
    {
      "PresenceId": 20,
      "MemberId": 54,
      "PresenceDate": "12.09.2025"
    },
    {
      "PresenceId": 21,
      "MemberId": 48,
      "PresenceDate": "12.09.2025"
    },
    {
      "PresenceId": 22,
      "MemberId": 52,
      "PresenceDate": "12.09.2025"
    },
    {
      "PresenceId": 23,
      "MemberId": 9,
      "PresenceDate": "12.09.2025"
    },
    {
      "PresenceId": 24,
      "MemberId": 17,
      "PresenceDate": "12.09.2025"
    },
    {
      "PresenceId": 25,
      "MemberId": 20,
      "PresenceDate": "12.09.2025"
    },
    {
      "PresenceId": 26,
      "MemberId": 34,
      "PresenceDate": "12.09.2025"
    },
    {
      "PresenceId": 27,
      "MemberId": 1,
      "PresenceDate": "12.09.2025"
    },
    {
      "PresenceId": 28,
      "MemberId": 8,
      "PresenceDate": "12.09.2025"
    },
    {
      "PresenceId": 29,
      "MemberId": 3,
      "PresenceDate": "12.09.2025"
    },
    {
      "PresenceId": 30,
      "MemberId": 19,
      "PresenceDate": "12.09.2025"
    },
    {
      "PresenceId": 31,
      "MemberId": 24,
      "PresenceDate": "12.09.2025"
    },
    {
      "PresenceId": 32,
      "MemberId": 16,
      "PresenceDate": "12.09.2025"
    },
    {
      "PresenceId": 33,
      "MemberId": 4,
      "PresenceDate": "19.09.2025"
    },
    {
      "PresenceId": 34,
      "MemberId": 31,
      "PresenceDate": "19.09.2025"
    },
    {
      "PresenceId": 35,
      "MemberId": 5,
      "PresenceDate": "19.09.2025"
    },
    {
      "PresenceId": 36,
      "MemberId": 54,
      "PresenceDate": "19.09.2025"
    },
    {
      "PresenceId": 37,
      "MemberId": 48,
      "PresenceDate": "19.09.2025"
    },
    {
      "PresenceId": 38,
      "MemberId": 52,
      "PresenceDate": "19.09.2025"
    },
    {
      "PresenceId": 39,
      "MemberId": 21,
      "PresenceDate": "19.09.2025"
    },
    {
      "PresenceId": 40,
      "MemberId": 11,
      "PresenceDate": "19.09.2025"
    },
    {
      "PresenceId": 41,
      "MemberId": 51,
      "PresenceDate": "19.09.2025"
    },
    {
      "PresenceId": 42,
      "MemberId": 20,
      "PresenceDate": "19.09.2025"
    },
    {
      "PresenceId": 43,
      "MemberId": 1,
      "PresenceDate": "19.09.2025"
    },
    {
      "PresenceId": 44,
      "MemberId": 8,
      "PresenceDate": "19.09.2025"
    },
    {
      "PresenceId": 45,
      "MemberId": 27,
      "PresenceDate": "19.09.2025"
    },
    {
      "PresenceId": 46,
      "MemberId": 3,
      "PresenceDate": "19.09.2025"
    },
    {
      "PresenceId": 47,
      "MemberId": 19,
      "PresenceDate": "19.09.2025"
    },
    {
      "PresenceId": 48,
      "MemberId": 24,
      "PresenceDate": "19.09.2025"
    },
    {
      "PresenceId": 49,
      "MemberId": 25,
      "PresenceDate": "26.09.2025"
    },
    {
      "PresenceId": 50,
      "MemberId": 31,
      "PresenceDate": "26.09.2025"
    },
    {
      "PresenceId": 51,
      "MemberId": 5,
      "PresenceDate": "26.09.2025"
    },
    {
      "PresenceId": 52,
      "MemberId": 12,
      "PresenceDate": "26.09.2025"
    },
    {
      "PresenceId": 53,
      "MemberId": 52,
      "PresenceDate": "26.09.2025"
    },
    {
      "PresenceId": 54,
      "MemberId": 43,
      "PresenceDate": "26.09.2025"
    },
    {
      "PresenceId": 55,
      "MemberId": 9,
      "PresenceDate": "26.09.2025"
    },
    {
      "PresenceId": 56,
      "MemberId": 21,
      "PresenceDate": "26.09.2025"
    },
    {
      "PresenceId": 57,
      "MemberId": 51,
      "PresenceDate": "26.09.2025"
    },
    {
      "PresenceId": 58,
      "MemberId": 17,
      "PresenceDate": "26.09.2025"
    },
    {
      "PresenceId": 59,
      "MemberId": 20,
      "PresenceDate": "26.09.2025"
    },
    {
      "PresenceId": 60,
      "MemberId": 34,
      "PresenceDate": "26.09.2025"
    },
    {
      "PresenceId": 61,
      "MemberId": 1,
      "PresenceDate": "26.09.2025"
    },
    {
      "PresenceId": 62,
      "MemberId": 8,
      "PresenceDate": "26.09.2025"
    },
    {
      "PresenceId": 63,
      "MemberId": 27,
      "PresenceDate": "26.09.2025"
    },
    {
      "PresenceId": 64,
      "MemberId": 19,
      "PresenceDate": "26.09.2025"
    },
    {
      "PresenceId": 65,
      "MemberId": 24,
      "PresenceDate": "26.09.2025"
    },
    {
      "PresenceId": 66,
      "MemberId": 4,
      "PresenceDate": "03.10.2025"
    },
    {
      "PresenceId": 67,
      "MemberId": 26,
      "PresenceDate": "03.10.2025"
    },
    {
      "PresenceId": 68,
      "MemberId": 31,
      "PresenceDate": "03.10.2025"
    },
    {
      "PresenceId": 69,
      "MemberId": 5,
      "PresenceDate": "03.10.2025"
    },
    {
      "PresenceId": 70,
      "MemberId": 12,
      "PresenceDate": "03.10.2025"
    },
    {
      "PresenceId": 71,
      "MemberId": 54,
      "PresenceDate": "03.10.2025"
    },
    {
      "PresenceId": 72,
      "MemberId": 52,
      "PresenceDate": "03.10.2025"
    },
    {
      "PresenceId": 73,
      "MemberId": 51,
      "PresenceDate": "03.10.2025"
    },
    {
      "PresenceId": 74,
      "MemberId": 22,
      "PresenceDate": "03.10.2025"
    },
    {
      "PresenceId": 75,
      "MemberId": 20,
      "PresenceDate": "03.10.2025"
    },
    {
      "PresenceId": 76,
      "MemberId": 34,
      "PresenceDate": "03.10.2025"
    },
    {
      "PresenceId": 77,
      "MemberId": 1,
      "PresenceDate": "03.10.2025"
    },
    {
      "PresenceId": 78,
      "MemberId": 55,
      "PresenceDate": "03.10.2025"
    },
    {
      "PresenceId": 79,
      "MemberId": 8,
      "PresenceDate": "03.10.2025"
    },
    {
      "PresenceId": 80,
      "MemberId": 3,
      "PresenceDate": "03.10.2025"
    },
    {
      "PresenceId": 81,
      "MemberId": 19,
      "PresenceDate": "03.10.2025"
    },
    {
      "PresenceId": 82,
      "MemberId": 24,
      "PresenceDate": "03.10.2025"
    },
    {
      "PresenceId": 83,
      "MemberId": 16,
      "PresenceDate": "03.10.2025"
    },
    {
      "PresenceId": 84,
      "MemberId": 25,
      "PresenceDate": "10.10.2025"
    },
    {
      "PresenceId": 85,
      "MemberId": 31,
      "PresenceDate": "10.10.2025"
    },
    {
      "PresenceId": 86,
      "MemberId": 54,
      "PresenceDate": "10.10.2025"
    },
    {
      "PresenceId": 87,
      "MemberId": 21,
      "PresenceDate": "10.10.2025"
    },
    {
      "PresenceId": 88,
      "MemberId": 22,
      "PresenceDate": "10.10.2025"
    },
    {
      "PresenceId": 89,
      "MemberId": 17,
      "PresenceDate": "10.10.2025"
    },
    {
      "PresenceId": 90,
      "MemberId": 20,
      "PresenceDate": "10.10.2025"
    },
    {
      "PresenceId": 91,
      "MemberId": 1,
      "PresenceDate": "10.10.2025"
    },
    {
      "PresenceId": 92,
      "MemberId": 55,
      "PresenceDate": "10.10.2025"
    },
    {
      "PresenceId": 93,
      "MemberId": 8,
      "PresenceDate": "10.10.2025"
    },
    {
      "PresenceId": 94,
      "MemberId": 3,
      "PresenceDate": "10.10.2025"
    },
    {
      "PresenceId": 95,
      "MemberId": 19,
      "PresenceDate": "10.10.2025"
    },
    {
      "PresenceId": 96,
      "MemberId": 24,
      "PresenceDate": "10.10.2025"
    },
    {
      "PresenceId": 97,
      "MemberId": 16,
      "PresenceDate": "10.10.2025"
    },
    {
      "PresenceId": 98,
      "MemberId": 26,
      "PresenceDate": "24.10.2025"
    },
    {
      "PresenceId": 99,
      "MemberId": 25,
      "PresenceDate": "24.10.2025"
    },
    {
      "PresenceId": 100,
      "MemberId": 31,
      "PresenceDate": "24.10.2025"
    },
    {
      "PresenceId": 101,
      "MemberId": 48,
      "PresenceDate": "24.10.2025"
    },
    {
      "PresenceId": 102,
      "MemberId": 52,
      "PresenceDate": "24.10.2025"
    },
    {
      "PresenceId": 103,
      "MemberId": 9,
      "PresenceDate": "24.10.2025"
    },
    {
      "PresenceId": 104,
      "MemberId": 21,
      "PresenceDate": "24.10.2025"
    },
    {
      "PresenceId": 105,
      "MemberId": 56,
      "PresenceDate": "24.10.2025"
    },
    {
      "PresenceId": 106,
      "MemberId": 22,
      "PresenceDate": "24.10.2025"
    },
    {
      "PresenceId": 107,
      "MemberId": 17,
      "PresenceDate": "24.10.2025"
    },
    {
      "PresenceId": 108,
      "MemberId": 20,
      "PresenceDate": "24.10.2025"
    },
    {
      "PresenceId": 109,
      "MemberId": 34,
      "PresenceDate": "24.10.2025"
    },
    {
      "PresenceId": 110,
      "MemberId": 1,
      "PresenceDate": "24.10.2025"
    },
    {
      "PresenceId": 111,
      "MemberId": 55,
      "PresenceDate": "24.10.2025"
    },
    {
      "PresenceId": 112,
      "MemberId": 8,
      "PresenceDate": "24.10.2025"
    },
    {
      "PresenceId": 113,
      "MemberId": 3,
      "PresenceDate": "24.10.2025"
    },
    {
      "PresenceId": 114,
      "MemberId": 19,
      "PresenceDate": "24.10.2025"
    },
    {
      "PresenceId": 115,
      "MemberId": 24,
      "PresenceDate": "24.10.2025"
    },
    {
      "PresenceId": 116,
      "MemberId": 16,
      "PresenceDate": "24.10.2025"
    },
    {
      "PresenceId": 117,
      "MemberId": 4,
      "PresenceDate": "07.11.2025"
    },
    {
      "PresenceId": 118,
      "MemberId": 26,
      "PresenceDate": "07.11.2025"
    },
    {
      "PresenceId": 119,
      "MemberId": 25,
      "PresenceDate": "07.11.2025"
    },
    {
      "PresenceId": 120,
      "MemberId": 5,
      "PresenceDate": "07.11.2025"
    },
    {
      "PresenceId": 121,
      "MemberId": 12,
      "PresenceDate": "07.11.2025"
    },
    {
      "PresenceId": 122,
      "MemberId": 54,
      "PresenceDate": "07.11.2025"
    },
    {
      "PresenceId": 123,
      "MemberId": 48,
      "PresenceDate": "07.11.2025"
    },
    {
      "PresenceId": 124,
      "MemberId": 43,
      "PresenceDate": "07.11.2025"
    },
    {
      "PresenceId": 125,
      "MemberId": 9,
      "PresenceDate": "07.11.2025"
    },
    {
      "PresenceId": 126,
      "MemberId": 22,
      "PresenceDate": "07.11.2025"
    },
    {
      "PresenceId": 127,
      "MemberId": 17,
      "PresenceDate": "07.11.2025"
    },
    {
      "PresenceId": 128,
      "MemberId": 20,
      "PresenceDate": "07.11.2025"
    },
    {
      "PresenceId": 129,
      "MemberId": 1,
      "PresenceDate": "07.11.2025"
    },
    {
      "PresenceId": 130,
      "MemberId": 55,
      "PresenceDate": "07.11.2025"
    },
    {
      "PresenceId": 131,
      "MemberId": 8,
      "PresenceDate": "07.11.2025"
    },
    {
      "PresenceId": 132,
      "MemberId": 27,
      "PresenceDate": "07.11.2025"
    },
    {
      "PresenceId": 133,
      "MemberId": 3,
      "PresenceDate": "07.11.2025"
    },
    {
      "PresenceId": 134,
      "MemberId": 19,
      "PresenceDate": "07.11.2025"
    },
    {
      "PresenceId": 135,
      "MemberId": 24,
      "PresenceDate": "07.11.2025"
    },
    {
      "PresenceId": 136,
      "MemberId": 25,
      "PresenceDate": "14.11.2025"
    },
    {
      "PresenceId": 137,
      "MemberId": 31,
      "PresenceDate": "14.11.2025"
    },
    {
      "PresenceId": 138,
      "MemberId": 5,
      "PresenceDate": "14.11.2025"
    },
    {
      "PresenceId": 139,
      "MemberId": 12,
      "PresenceDate": "14.11.2025"
    },
    {
      "PresenceId": 140,
      "MemberId": 54,
      "PresenceDate": "14.11.2025"
    },
    {
      "PresenceId": 141,
      "MemberId": 52,
      "PresenceDate": "14.11.2025"
    },
    {
      "PresenceId": 142,
      "MemberId": 21,
      "PresenceDate": "14.11.2025"
    },
    {
      "PresenceId": 143,
      "MemberId": 56,
      "PresenceDate": "14.11.2025"
    },
    {
      "PresenceId": 144,
      "MemberId": 22,
      "PresenceDate": "14.11.2025"
    },
    {
      "PresenceId": 145,
      "MemberId": 20,
      "PresenceDate": "14.11.2025"
    },
    {
      "PresenceId": 146,
      "MemberId": 34,
      "PresenceDate": "14.11.2025"
    },
    {
      "PresenceId": 147,
      "MemberId": 1,
      "PresenceDate": "14.11.2025"
    },
    {
      "PresenceId": 148,
      "MemberId": 55,
      "PresenceDate": "14.11.2025"
    },
    {
      "PresenceId": 149,
      "MemberId": 27,
      "PresenceDate": "14.11.2025"
    },
    {
      "PresenceId": 150,
      "MemberId": 3,
      "PresenceDate": "14.11.2025"
    },
    {
      "PresenceId": 151,
      "MemberId": 19,
      "PresenceDate": "14.11.2025"
    },
    {
      "PresenceId": 152,
      "MemberId": 24,
      "PresenceDate": "14.11.2025"
    },
    {
      "PresenceId": 153,
      "MemberId": 16,
      "PresenceDate": "14.11.2025"
    },
    {
      "PresenceId": 154,
      "MemberId": 26,
      "PresenceDate": "28.11.2025"
    },
    {
      "PresenceId": 155,
      "MemberId": 25,
      "PresenceDate": "28.11.2025"
    },
    {
      "PresenceId": 156,
      "MemberId": 54,
      "PresenceDate": "28.11.2025"
    },
    {
      "PresenceId": 157,
      "MemberId": 52,
      "PresenceDate": "28.11.2025"
    },
    {
      "PresenceId": 158,
      "MemberId": 43,
      "PresenceDate": "28.11.2025"
    },
    {
      "PresenceId": 159,
      "MemberId": 9,
      "PresenceDate": "28.11.2025"
    },
    {
      "PresenceId": 160,
      "MemberId": 22,
      "PresenceDate": "28.11.2025"
    },
    {
      "PresenceId": 161,
      "MemberId": 17,
      "PresenceDate": "28.11.2025"
    },
    {
      "PresenceId": 162,
      "MemberId": 20,
      "PresenceDate": "28.11.2025"
    },
    {
      "PresenceId": 163,
      "MemberId": 1,
      "PresenceDate": "28.11.2025"
    },
    {
      "PresenceId": 164,
      "MemberId": 55,
      "PresenceDate": "28.11.2025"
    },
    {
      "PresenceId": 165,
      "MemberId": 8,
      "PresenceDate": "28.11.2025"
    },
    {
      "PresenceId": 166,
      "MemberId": 3,
      "PresenceDate": "28.11.2025"
    },
    {
      "PresenceId": 167,
      "MemberId": 19,
      "PresenceDate": "28.11.2025"
    },
    {
      "PresenceId": 168,
      "MemberId": 24,
      "PresenceDate": "28.11.2025"
    },
    {
      "PresenceId": 169,
      "MemberId": 16,
      "PresenceDate": "28.11.2025"
    },
    {
      "PresenceId": 170,
      "MemberId": 26,
      "PresenceDate": "05.12.2025"
    },
    {
      "PresenceId": 171,
      "MemberId": 31,
      "PresenceDate": "05.12.2025"
    },
    {
      "PresenceId": 172,
      "MemberId": 5,
      "PresenceDate": "05.12.2025"
    },
    {
      "PresenceId": 173,
      "MemberId": 54,
      "PresenceDate": "05.12.2025"
    },
    {
      "PresenceId": 174,
      "MemberId": 48,
      "PresenceDate": "05.12.2025"
    },
    {
      "PresenceId": 175,
      "MemberId": 52,
      "PresenceDate": "05.12.2025"
    },
    {
      "PresenceId": 176,
      "MemberId": 9,
      "PresenceDate": "05.12.2025"
    },
    {
      "PresenceId": 177,
      "MemberId": 22,
      "PresenceDate": "05.12.2025"
    },
    {
      "PresenceId": 178,
      "MemberId": 20,
      "PresenceDate": "05.12.2025"
    },
    {
      "PresenceId": 179,
      "MemberId": 1,
      "PresenceDate": "05.12.2025"
    },
    {
      "PresenceId": 180,
      "MemberId": 3,
      "PresenceDate": "05.12.2025"
    },
    {
      "PresenceId": 181,
      "MemberId": 19,
      "PresenceDate": "05.12.2025"
    },
    {
      "PresenceId": 182,
      "MemberId": 24,
      "PresenceDate": "05.12.2025"
    },
    {
      "PresenceId": 183,
      "MemberId": 16,
      "PresenceDate": "05.12.2025"
    },
    {
      "PresenceId": 184,
      "MemberId": 26,
      "PresenceDate": "12.12.2025"
    },
    {
      "PresenceId": 185,
      "MemberId": 25,
      "PresenceDate": "12.12.2025"
    },
    {
      "PresenceId": 186,
      "MemberId": 31,
      "PresenceDate": "12.12.2025"
    },
    {
      "PresenceId": 187,
      "MemberId": 9,
      "PresenceDate": "12.12.2025"
    },
    {
      "PresenceId": 188,
      "MemberId": 21,
      "PresenceDate": "12.12.2025"
    },
    {
      "PresenceId": 189,
      "MemberId": 22,
      "PresenceDate": "12.12.2025"
    },
    {
      "PresenceId": 190,
      "MemberId": 17,
      "PresenceDate": "12.12.2025"
    },
    {
      "PresenceId": 191,
      "MemberId": 20,
      "PresenceDate": "12.12.2025"
    },
    {
      "PresenceId": 192,
      "MemberId": 1,
      "PresenceDate": "12.12.2025"
    },
    {
      "PresenceId": 193,
      "MemberId": 55,
      "PresenceDate": "12.12.2025"
    },
    {
      "PresenceId": 194,
      "MemberId": 8,
      "PresenceDate": "12.12.2025"
    },
    {
      "PresenceId": 195,
      "MemberId": 3,
      "PresenceDate": "12.12.2025"
    },
    {
      "PresenceId": 196,
      "MemberId": 19,
      "PresenceDate": "12.12.2025"
    },
    {
      "PresenceId": 197,
      "MemberId": 24,
      "PresenceDate": "12.12.2025"
    },
    {
      "PresenceId": 213,
      "MemberId": 26,
      "PresenceDate": "19.12.2025"
    },
    {
      "PresenceId": 214,
      "MemberId": 5,
      "PresenceDate": "19.12.2025"
    },
    {
      "PresenceId": 215,
      "MemberId": 12,
      "PresenceDate": "19.12.2025"
    },
    {
      "PresenceId": 216,
      "MemberId": 54,
      "PresenceDate": "19.12.2025"
    },
    {
      "PresenceId": 217,
      "MemberId": 43,
      "PresenceDate": "19.12.2025"
    },
    {
      "PresenceId": 218,
      "MemberId": 21,
      "PresenceDate": "19.12.2025"
    },
    {
      "PresenceId": 219,
      "MemberId": 22,
      "PresenceDate": "19.12.2025"
    },
    {
      "PresenceId": 220,
      "MemberId": 20,
      "PresenceDate": "19.12.2025"
    },
    {
      "PresenceId": 221,
      "MemberId": 34,
      "PresenceDate": "19.12.2025"
    },
    {
      "PresenceId": 222,
      "MemberId": 1,
      "PresenceDate": "19.12.2025"
    },
    {
      "PresenceId": 223,
      "MemberId": 55,
      "PresenceDate": "19.12.2025"
    },
    {
      "PresenceId": 224,
      "MemberId": 8,
      "PresenceDate": "19.12.2025"
    },
    {
      "PresenceId": 225,
      "MemberId": 3,
      "PresenceDate": "19.12.2025"
    },
    {
      "PresenceId": 226,
      "MemberId": 19,
      "PresenceDate": "19.12.2025"
    },
    {
      "PresenceId": 227,
      "MemberId": 24,
      "PresenceDate": "19.12.2025"
    },
    {
      "PresenceId": 228,
      "MemberId": 16,
      "PresenceDate": "19.12.2025"
    },
    {
      "PresenceId": 230,
      "MemberId": 5,
      "PresenceDate": "09.01.2026"
    },
    {
      "PresenceId": 231,
      "MemberId": 54,
      "PresenceDate": "09.01.2026"
    },
    {
      "PresenceId": 232,
      "MemberId": 22,
      "PresenceDate": "09.01.2026"
    },
    {
      "PresenceId": 233,
      "MemberId": 20,
      "PresenceDate": "09.01.2026"
    },
    {
      "PresenceId": 234,
      "MemberId": 1,
      "PresenceDate": "09.01.2026"
    },
    {
      "PresenceId": 235,
      "MemberId": 55,
      "PresenceDate": "09.01.2026"
    },
    {
      "PresenceId": 236,
      "MemberId": 3,
      "PresenceDate": "09.01.2026"
    },
    {
      "PresenceId": 237,
      "MemberId": 19,
      "PresenceDate": "09.01.2026"
    },
    {
      "PresenceId": 238,
      "MemberId": 24,
      "PresenceDate": "09.01.2026"
    }
  ]
}